CNPJ,Nome da empresa
00000000,BANCO DO BRASIL SA
00000001,ASSOCIACAO DE AMIGOS DE BAIRRO DO CONJ PAULISTANO
00000002,WM&R EMPREITEIRA DE CONSTRUCAO CIVIL LIMITADA
00000003,CASA CARIDADE LUZETE ROBERTA DE MORAIS CONJ PAULISTANO
00000004,ASSOCIACAO DO PEQUENO ADOLECENTE DO CONJ PAULISTANO
00000005,SERRALHERIA PORTA DE ACO REAL S/C LTDA
00000006,ACADEMIA DE BALLET PAULA FIRETTI LTDA
00000007,ADVOCACIA BERGANTIN E ASSOCIADOS
00000008,A.R. ZANOTI E SILVA S/C LTDA
00000009,SUWAN REPRESENTACOES LTDA
00000010,ADUB SERVICOS GERAIS DE AUTOS LTDA
00000011,KAWANISHI MANUTENCAO ELETRICA INDUSTRIAL S/C LTDA
00000012,APARTH ADMINISTRACAO S/C LTDA
00000013,SAMPAIO SERVICOS CONTABEIS LTDA
00000014,CLUBE DE MAES DA CASA VERDE ALTA E ADJACENCIAS
00000015,DOS - INSTALACAO DE SISTEMAS DE AUDIO E VIDEO S/S LTDA
00000016,MICRO-ARTE COMUNICACOES VISUAIS LTDA
00000017,ASSOCIACAO VIVER EM CRISTO
